{"specversion":"1.0","type":"porfirium.run.result_proposed.v1","id":"22e29722-bd91-4f1a-8c74-91ffc3b86bfc","source":"agent-runtime-api","subject":"run/0646af1f-e305-4ec0-a47e-cff026f41a42","time":"2026-09-05T10:16:30Z","user_id":"c6d45c64-d9a7-4c31-ac4c-2e33e24c83ae","conversation_id":"35d05b66-52ac-453c-bdf2-a5f720ed1372","thread_id":"8bb476e5-67ae-45c3-8df7-9919b56d2c78","run_id":"0646af1f-e305-4ec0-a47e-cff026f41a42","attempt_id":"8d090021-3812-4c30-b258-ab776c74704f","lease_epoch":1,"correlation_id":"51167a9f-e2a1-4d07-90a6-d3ca19ec9a04","causation_id":"11e29722-bd91-4f1a-8c74-91ffc3b86bfc","traceparent":"00-51167a9fe2a14d0790a6d3ca19ec9a04-43f1670ab21c4f08-01","schema_version":1,"aggregate_sequence":8,"data":{"run_id":"0646af1f-e305-4ec0-a47e-cff026f41a42","attempt_id":"8d090021-3812-4c30-b258-ab776c74704f","lease_epoch":1,"final_message_ids":["08618216-a0c8-4c7e-85c4-f252e96894e0"],"final_checkpoint_id":null,"required_confirmations":["messages"]}}
