{"specversion":"1.0","type":"porfirium.run.command.schedule.v1","id":"11e29722-bd91-4f1a-8c74-91ffc3b86bfc","source":"agent-runner","subject":"run/0646af1f-e305-4ec0-a47e-cff026f41a42","time":"2026-09-05T10:15:30Z","user_id":"c6d45c64-d9a7-4c31-ac4c-2e33e24c83ae","conversation_id":"35d05b66-52ac-453c-bdf2-a5f720ed1372","thread_id":"8bb476e5-67ae-45c3-8df7-9919b56d2c78","run_id":"0646af1f-e305-4ec0-a47e-cff026f41a42","correlation_id":"51167a9f-e2a1-4d07-90a6-d3ca19ec9a04","causation_id":"b59bfbc5-024c-46a8-a6c6-76d226c60193","traceparent":"00-51167a9fe2a14d0790a6d3ca19ec9a04-43f1670ab21c4f08-01","schema_version":1,"aggregate_sequence":1,"data":{"run_id":"0646af1f-e305-4ec0-a47e-cff026f41a42","action":"schedule","idempotency_key":"schedule-0646af1f"}}
