{"specversion":"1.0","type":"porfirium.input.command.respond.v1","id":"44e29722-bd91-4f1a-8c74-91ffc3b86bfc","source":"conversation-service","subject":"input/c255db7b-d00e-4a68-b055-e837a3864b5a","time":"2026-09-05T10:18:30Z","user_id":"c6d45c64-d9a7-4c31-ac4c-2e33e24c83ae","conversation_id":"35d05b66-52ac-453c-bdf2-a5f720ed1372","thread_id":"8bb476e5-67ae-45c3-8df7-9919b56d2c78","run_id":"18886012-fc50-41bf-a444-50fe9fc9aa4b","correlation_id":"51167a9f-e2a1-4d07-90a6-d3ca19ec9a04","causation_id":"33e29722-bd91-4f1a-8c74-91ffc3b86bfc","traceparent":"00-51167a9fe2a14d0790a6d3ca19ec9a04-43f1670ab21c4f08-01","schema_version":1,"aggregate_sequence":10,"data":{"input_request_id":"c255db7b-d00e-4a68-b055-e837a3864b5a","response_id":"f5c616e0-a910-458d-a3c6-1ac87c7f9015","resume_run_id":"18886012-fc50-41bf-a444-50fe9fc9aa4b","idempotency_key":"input-response-1","response":{"approved":true}}}
